,sentences
201,with the reve platform you can find a whole lot of ai powered and advanced engagement tools that can contribute massively to your effort to deliver amazing services
202,you can start free trial of our chatbot and even test out other tools and see how they could fit well into your company s customer service needs
203,start a day free trial no credit card required
204,praveen singh is a content marketer blogger and professional with years of passion for ideas stats and insights into customers
205,an mba graduate in marketing and a researcher by disposition he has a knack for everything related to customer engagement and customer happiness
206,as a writer and analyst he pours the heart out on a blog that is informative detailed and often digs deep into the heart of customer psychology
207,he s written extensively on a range of topics including marketing ai chatbots omnichannel messaging platforms and many more
208,mr
209,singh also has a passion for subjects that excite new age customers be it social media engagement artificial intelligence machine learning
210,he takes great pride in his learning filled journey of adding value to the industry through consistent research analysis and sharing of customer driven ideas
211,praveen singh is a content marketer blogger and professional with years of passion for ideas stats and insights into customers
212,an mba graduate in marketing and a researcher by disposition he has a knack for everything related to customer engagement and customer happiness
213,as a writer and analyst he pours the heart out on a blog that is informative detailed and often digs deep into the heart of customer psychology
214,he s written extensively on a range of topics including marketing ai chatbots omnichannel messaging platforms and many more
215,mr
216,singh also has a passion for subjects that excite new age customers be it social media engagement artificial intelligence machine learning
217,he takes great pride in his learning filled journey of adding value to the industry through consistent research analysis and sharing of customer driven ideas
218,your email address will not be published
219,required fields are marked
220,comment
221,name
222,email
223,website
224,the banking landscape is undergoing a revolutionary transformation where convenience is king and time is of the essence
225,omnichannel banking
226,when you run an ecommerce business you may have experienced situations when nothing seems to work
227,you feel as if
228,instagram started in as a photo sharing app but it quickly evolved into a platform for global businesses and buyers
229,get a free demo
230,reve chat is an omnichannel customer communication platform that offers ai powered chatbot live chat video chat co browsing etc
